{
  "schemaVersion": "1.0.0",
  "contractType": "BENCHMARK_EVALUATION_ADJUDICATION_DECISION_RECORD",
  "recordId": "SEM3-ADR-B4-CAL-CARDIO-RHYTHM-REMODELING-BASELINE-P15",
  "decision": "EQUIVALENT",
  "rationale": "Precommitted simulated calibration classification derived from the frozen Acceptance Envelope; this tests governed Level 2 decision consumption and is not a human or PD-011 judgment.",
  "authorityClass": "SIMULATED_PLURALISTIC_EXPERT_REVIEW",
  "evidenceBasis": "SIMULATED_EXPERT_REVIEW_EVIDENCE",
  "sourceDecisionId": "SEM3B4-PRECOMMIT-SEM3-EVAL-CAND-CAL-CARDIO-RHYTHM-REMODELING-BASELINE-P15",
  "reviewBasis": "SIMULATED_PLURALISTIC_EXPERT_REVIEW",
  "eligibility": {
    "developmentEvaluatorTesting": true,
    "developmentCalibration": true,
    "formalIndependentQualification": false,
    "blindReferenceAdmission": false,
    "pd011FinalEvidence": false
  },
  "provenance": {
    "sourceRecordRef": "semantic-validation/sem-003/review/artifacts/calibration-reference-set.json#SEM3B3-RU-CAL-CARDIO-RHYTHM-REMODELING",
    "recordedAt": "2026-08-13T22:00:00.000Z",
    "realHumanReview": false
  },
  "target": {
    "scope": "ADJUDICATION_PACKET",
    "caseId": "SEM3-CAL-CARDIO-RHYTHM-REMODELING",
    "candidateIds": [
      "SEM3-EVAL-CAND-CAL-CARDIO-RHYTHM-REMODELING-BASELINE"
    ],
    "packetIds": [
      "SEM3-ADJ-CAL-CARDIO-RHYTHM-REMODELING-BASELINE-P15"
    ],
    "propertyIds": [
      "PROPERTY_SEMANTIC_EQUIVALENCE_RECOGNIZED"
    ]
  },
  "status": "FINAL"
}
